{
  "id": "7e8f9a0b-1c2d-4e3f-4a5b-6c7d8e9f0a1b",
  "workshop_id": "3f4e5d6c-7b8a-4c9d-0e1f-2a3b4c5d6e7f",
  "title": "Évaluation Formation du Faire ensemble",
  "description": "Merci de prendre quelques minutes pour nous faire part de votre retour sur la formation. Vos réponses nous aideront à améliorer nos futurs ateliers.",
  "questions": [
    {
      "question_id": "q1",
      "text": "Comment évaluez-vous la qualité globale de la formation ?",
      "type": "scale",
      "options": null,
      "scale_min": 1,
      "scale_max": 5,
      "is_required": true,
      "order": 1
    },
    {
      "question_id": "q2",
      "text": "Les objectifs de la formation étaient-ils clairement définis ?",
      "type": "yes_no",
      "options": null,
      "scale_min": null,
      "scale_max": null,
      "is_required": true,
      "order": 2
    },
    {
      "question_id": "q3",
      "text": "Quels aspects de la formation avez-vous particulièrement appréciés ?",
      "type": "multiple_choice",
      "options": [
        "La qualité de l'animation",
        "Le contenu pédagogique",
        "Les exercices pratiques",
        "Les échanges avec le groupe",
        "Le support de formation"
      ],
      "scale_min": null,
      "scale_max": null,
      "is_required": false,
      "order": 3
    },
    {
      "question_id": "q4",
      "text": "Avez-vous des suggestions pour améliorer cette formation ?",
      "type": "text",
      "options": null,
      "scale_min": null,
      "scale_max": null,
      "is_required": false,
      "order": 4
    },
    {
      "question_id": "q5",
      "text": "Recommanderiez-vous cette formation à un collègue ?",
      "type": "rating",
      "options": null,
      "scale_min": 1,
      "scale_max": 10,
      "is_required": true,
      "order": 5
    }
  ],
  "is_active": true,
  "available_from": "2025-11-15T17:00:00Z",
  "available_until": "2025-11-30T23:59:59Z",
  "tenant_id": "1er-Degré",
  "created_at": "2025-09-01T10:30:00Z",
  "updated_at": "2025-10-05T14:30:00Z"
}
